{
  "$schema": "https://json-schema.org/draft/2020-12/schema",
  "$id": "intelligence-codex-plugin.schema.json",
  "title": "Codex Plugin Adapter Manifest",
  "description": "Generated Codex-native plugin manifest projection derived from a provider-neutral plugin manifest.",
  "type": "object",
  "required": [
    "name",
    "version",
    "description",
    "author",
    "license",
    "keywords",
    "interface"
  ],
  "properties": {
    "name": {
      "$ref": "#/$defs/name"
    },
    "version": {
      "type": "string",
      "pattern": "^(0|[1-9][0-9]*)\\.(0|[1-9][0-9]*)\\.(0|[1-9][0-9]*)(?:-[0-9A-Za-z.-]+)?(?:\\+[0-9A-Za-z.-]+)?$"
    },
    "description": {
      "type": "string",
      "minLength": 1
    },
    "author": {
      "type": "object",
      "required": [
        "name"
      ],
      "properties": {
        "name": {
          "type": "string",
          "minLength": 1
        },
        "email": {
          "type": "string",
          "minLength": 1
        },
        "url": {
          "type": "string",
          "format": "uri"
        }
      },
      "additionalProperties": false
    },
    "license": {
      "type": "string",
      "minLength": 1
    },
    "keywords": {
      "type": "array",
      "items": {
        "type": "string",
        "minLength": 1
      },
      "uniqueItems": true
    },
    "skills": {
      "type": "string",
      "enum": [
        "./skills/"
      ]
    },
    "interface": {
      "type": "object",
      "required": [
        "displayName",
        "shortDescription",
        "longDescription",
        "developerName",
        "category",
        "capabilities",
        "brandColor",
        "defaultPrompt"
      ],
      "properties": {
        "displayName": {
          "type": "string",
          "minLength": 1
        },
        "shortDescription": {
          "type": "string",
          "minLength": 1
        },
        "longDescription": {
          "type": "string",
          "minLength": 1
        },
        "developerName": {
          "type": "string",
          "minLength": 1
        },
        "category": {
          "type": "string",
          "minLength": 1
        },
        "capabilities": {
          "type": "array",
          "items": {
            "type": "string",
            "minLength": 1
          },
          "minItems": 1,
          "uniqueItems": true
        },
        "brandColor": {
          "type": "string",
          "pattern": "^#[0-9A-Fa-f]{6}$"
        },
        "defaultPrompt": {
          "type": "array",
          "items": {
            "type": "string",
            "minLength": 1,
            "maxLength": 128
          },
          "minItems": 1,
          "maxItems": 3
        }
      },
      "additionalProperties": false
    }
  },
  "additionalProperties": false,
  "$defs": {
    "name": {
      "type": "string",
      "pattern": "^[a-z0-9](?:[a-z0-9-]*[a-z0-9])?$"
    }
  }
}
