{
  "author": {
    "name": "Amichne"
  },
  "description": "Core type-safety, schema-driven design, onboarding, and turn-time hooks for rigorous repository work.",
  "interface": {
    "brandColor": "#0F766E",
    "capabilities": [
      "Interactive",
      "Write"
    ],
    "category": "Engineering",
    "defaultPrompt": [
      "Use Typed Design Discipline for this task.",
      "Review this repo with Typed Design Discipline.",
      "Show the Typed Design Discipline workflow."
    ],
    "developerName": "Amichne",
    "displayName": "Typed Design Discipline",
    "longDescription": "Core type-safety, schema-driven design, onboarding, and turn-time hooks for rigorous repository work.",
    "shortDescription": "Core type-safety, schema-driven design, onboarding, and turn-time hoo..."
  },
  "keywords": [
    "core",
    "design",
    "hooks",
    "instructions",
    "onboarding",
    "schemas",
    "skills",
    "typed-design-discipline"
  ],
  "license": "UNLICENSED",
  "name": "typed-design-discipline",
  "skills": "./skills/",
  "version": "0.1.0"
}
