{
  "author": {
    "name": "Amichne"
  },
  "description": "Documentation planning and site-authoring workflows composed from independent skills.",
  "interface": {
    "brandColor": "#7C3AED",
    "capabilities": [
      "Interactive",
      "Write"
    ],
    "category": "Productivity",
    "defaultPrompt": [
      "Use Documentation Workflow for this task.",
      "Review this repo with Documentation Workflow.",
      "Show the Documentation Workflow workflow."
    ],
    "developerName": "Amichne",
    "displayName": "Documentation Workflow",
    "longDescription": "Documentation planning and site-authoring workflows composed from independent skills.",
    "shortDescription": "Documentation planning and site-authoring workflows composed from ind..."
  },
  "keywords": [
    "docs",
    "documentation-workflow",
    "mkdocs",
    "skills",
    "workflow",
    "zensical"
  ],
  "license": "UNLICENSED",
  "name": "documentation-workflow",
  "skills": "./skills/",
  "version": "0.1.0"
}
