{
  "author": {
    "name": "Amichne"
  },
  "description": "API contract workflow for JSON Schema and OpenAPI boundaries: schema modeling, operation authoring, typed errors, examples, and review.",
  "interface": {
    "brandColor": "#0F766E",
    "capabilities": [
      "Interactive",
      "Write"
    ],
    "category": "Engineering",
    "defaultPrompt": [
      "Use API Contracts for this task.",
      "Review this repo with API Contracts.",
      "Show the API Contracts workflow."
    ],
    "developerName": "Amichne",
    "displayName": "API Contracts",
    "longDescription": "API contract workflow for JSON Schema and OpenAPI boundaries: schema modeling, operation authoring, typed errors, examples, and review.",
    "shortDescription": "API contract workflow for JSON Schema and OpenAPI boundaries: schema..."
  },
  "keywords": [
    "agents",
    "api",
    "api-contracts",
    "boundary",
    "contracts",
    "governance",
    "openapi",
    "schemas",
    "skills",
    "validation"
  ],
  "license": "UNLICENSED",
  "name": "api-contracts",
  "skills": "./skills/",
  "version": "0.1.0"
}
