{
  "author": {
    "name": "Amichne"
  },
  "description": "Git process, GitHub CI, workflow, and release operations composed from independent skills.",
  "interface": {
    "brandColor": "#0F766E",
    "capabilities": [
      "Interactive",
      "Write"
    ],
    "category": "Engineering",
    "defaultPrompt": [
      "Use Version Control for this task.",
      "Review this repo with Version Control.",
      "Show the Version Control workflow."
    ],
    "developerName": "Amichne",
    "displayName": "Version Control",
    "longDescription": "Git process, GitHub CI, workflow, and release operations composed from independent skills.",
    "shortDescription": "Git process, GitHub CI, workflow, and release operations composed fro..."
  },
  "keywords": [
    "ci",
    "git",
    "github",
    "skills",
    "version-control",
    "workflow"
  ],
  "license": "UNLICENSED",
  "name": "version-control",
  "skills": "./skills/",
  "version": "0.1.0"
}
