{
  "author": {
    "name": "Amichne"
  },
  "description": "Goal-definition and reference-document workflows composed from independent skills.",
  "interface": {
    "brandColor": "#7C3AED",
    "capabilities": [
      "Interactive",
      "Write"
    ],
    "category": "Productivity",
    "defaultPrompt": [
      "Use Planning And Docs for this task.",
      "Review this repo with Planning And Docs.",
      "Show the Planning And Docs workflow."
    ],
    "developerName": "Amichne",
    "displayName": "Planning And Docs",
    "longDescription": "Goal-definition and reference-document workflows composed from independent skills.",
    "shortDescription": "Goal-definition and reference-document workflows composed from indepe..."
  },
  "keywords": [
    "docs",
    "planning",
    "planning-and-docs",
    "skills",
    "workflow"
  ],
  "license": "UNLICENSED",
  "name": "planning-and-docs",
  "skills": "./skills/",
  "version": "0.1.0"
}
