{
  "author": {
    "name": "Amichne"
  },
  "description": "Test-driven workflow composed from an independent TDD skill and source-of-truth design concepts.",
  "interface": {
    "brandColor": "#2563EB",
    "capabilities": [
      "Interactive",
      "Write"
    ],
    "category": "Coding",
    "defaultPrompt": [
      "Use Tdd Workflow for this task.",
      "Review this repo with Tdd Workflow.",
      "Show the Tdd Workflow workflow."
    ],
    "developerName": "Amichne",
    "displayName": "Tdd Workflow",
    "longDescription": "Test-driven workflow composed from an independent TDD skill and source-of-truth design concepts.",
    "shortDescription": "Test-driven workflow composed from an independent TDD skill and sourc..."
  },
  "keywords": [
    "skills",
    "tdd-workflow",
    "testing",
    "workflow"
  ],
  "license": "UNLICENSED",
  "name": "tdd-workflow",
  "skills": "./skills/",
  "version": "0.1.0"
}
