{
  "author": {
    "name": "Amichne"
  },
  "description": "Agent platform authoring kit for maintaining the source graph: skills, agents, hooks, schemas, plugin manifests, repo maps, and docs surfaces.",
  "interface": {
    "brandColor": "#0F766E",
    "capabilities": [
      "Interactive",
      "Write"
    ],
    "category": "Engineering",
    "defaultPrompt": [
      "Use Agent Platform Authoring for this task.",
      "Review this repo with Agent Platform Authoring.",
      "Show the Agent Platform Authoring workflow."
    ],
    "developerName": "Amichne",
    "displayName": "Agent Platform Authoring",
    "longDescription": "Agent platform authoring kit for maintaining the source graph: skills, agents, hooks, schemas, plugin manifests, repo maps, and docs surfaces.",
    "shortDescription": "Agent platform authoring kit for maintaining the source graph: skills..."
  },
  "keywords": [
    "agent-platform-authoring",
    "agents",
    "authoring",
    "docs",
    "governance",
    "hooks",
    "marketplace",
    "plugins",
    "repository",
    "schemas",
    "shell",
    "skills",
    "workflow"
  ],
  "license": "UNLICENSED",
  "name": "agent-platform-authoring",
  "skills": "./skills/",
  "version": "0.1.0"
}
