{
  "author": {
    "name": "Amichne"
  },
  "description": "Kotlin standards, Gradle validation, review agents, and layout gate composed from independent skill, agent, hook, and concept primitives.",
  "interface": {
    "brandColor": "#2563EB",
    "capabilities": [
      "Interactive",
      "Write"
    ],
    "category": "Coding",
    "defaultPrompt": [
      "Use Kotlin Review for this task.",
      "Review this repo with Kotlin Review.",
      "Show the Kotlin Review workflow."
    ],
    "developerName": "Amichne",
    "displayName": "Kotlin Review",
    "longDescription": "Kotlin standards, Gradle validation, review agents, and layout gate composed from independent skill, agent, hook, and concept primitives.",
    "shortDescription": "Kotlin standards, Gradle validation, review agents, and layout gate c..."
  },
  "keywords": [
    "agents",
    "gradle",
    "hooks",
    "kotlin",
    "kotlin-review",
    "review",
    "skills",
    "validation"
  ],
  "license": "UNLICENSED",
  "name": "kotlin-review",
  "skills": "./skills/",
  "version": "0.1.0"
}
