{
  "author": {
    "name": "Amichne"
  },
  "description": "Schema contract workflow composed from independent schema skill, review agent, and concept primitives.",
  "interface": {
    "brandColor": "#0F766E",
    "capabilities": [
      "Interactive",
      "Write"
    ],
    "category": "Engineering",
    "defaultPrompt": [
      "Use Schema Governance for this task.",
      "Review this repo with Schema Governance.",
      "Show the Schema Governance workflow."
    ],
    "developerName": "Amichne",
    "displayName": "Schema Governance",
    "longDescription": "Schema contract workflow composed from independent schema skill, review agent, and concept primitives.",
    "shortDescription": "Schema contract workflow composed from independent schema skill, revi..."
  },
  "keywords": [
    "agents",
    "schema-governance",
    "schemas",
    "skills",
    "validation"
  ],
  "license": "UNLICENSED",
  "name": "schema-governance",
  "skills": "./skills/",
  "version": "0.1.0"
}
