{
  "author": {
    "name": "Amichne"
  },
  "description": "Kotlin engineering workflow for code changes that need typed design, Kast semantics, review, filesystem evidence, Gradle proof, CI, and PR delivery.",
  "interface": {
    "brandColor": "#0F766E",
    "capabilities": [
      "Interactive",
      "Write"
    ],
    "category": "Engineering",
    "defaultPrompt": [
      "Use Kotlin Engineering for this task.",
      "Review this repo with Kotlin Engineering.",
      "Show the Kotlin Engineering workflow."
    ],
    "developerName": "Amichne",
    "displayName": "Kotlin Engineering",
    "longDescription": "Kotlin engineering workflow for code changes that need typed design, Kast semantics, review, filesystem evidence, Gradle proof, CI, and PR delivery.",
    "shortDescription": "Kotlin engineering workflow for code changes that need typed design,..."
  },
  "keywords": [
    "agents",
    "ci",
    "daily-driver",
    "delivery",
    "evidence",
    "gradle",
    "hooks",
    "kast",
    "kotlin",
    "kotlin-engineering",
    "operating-procedure",
    "quality",
    "review",
    "schemas",
    "skills",
    "testing",
    "validation"
  ],
  "license": "UNLICENSED",
  "name": "kotlin-engineering",
  "skills": "./skills/",
  "version": "0.1.0"
}
