{
  "author": {
    "name": "Amichne"
  },
  "description": "Repository boundary mapping, scoped instruction authoring, and signature indexing composed from independent skills.",
  "interface": {
    "brandColor": "#7C3AED",
    "capabilities": [
      "Interactive",
      "Write"
    ],
    "category": "Productivity",
    "defaultPrompt": [
      "Use Repository Orientation for this task.",
      "Review this repo with Repository Orientation.",
      "Show the Repository Orientation workflow."
    ],
    "developerName": "Amichne",
    "displayName": "Repository Orientation",
    "longDescription": "Repository boundary mapping, scoped instruction authoring, and signature indexing composed from independent skills.",
    "shortDescription": "Repository boundary mapping, scoped instruction authoring, and signat..."
  },
  "keywords": [
    "docs",
    "instructions",
    "repository",
    "repository-orientation",
    "signatures",
    "skills"
  ],
  "license": "UNLICENSED",
  "name": "repository-orientation",
  "skills": "./skills/",
  "version": "0.1.0"
}
