{
  "author": {
    "name": "Amichne"
  },
  "description": "Strict JSON Schema and OpenAPI contract work with typed boundary assertions, explicit variants, and contract review.",
  "interface": {
    "brandColor": "#0F766E",
    "capabilities": [
      "Interactive",
      "Write"
    ],
    "category": "Engineering",
    "defaultPrompt": [
      "Use Contract Governance for this task.",
      "Review this repo with Contract Governance.",
      "Show the Contract Governance workflow."
    ],
    "developerName": "Amichne",
    "displayName": "Contract Governance",
    "longDescription": "Strict JSON Schema and OpenAPI contract work with typed boundary assertions, explicit variants, and contract review.",
    "shortDescription": "Strict JSON Schema and OpenAPI contract work with typed boundary asse..."
  },
  "keywords": [
    "agents",
    "api",
    "contract-governance",
    "contracts",
    "openapi",
    "schemas",
    "skills",
    "validation"
  ],
  "license": "UNLICENSED",
  "name": "contract-governance",
  "skills": "./skills/",
  "version": "0.1.0"
}
