{
  "author": {
    "name": "Amichne"
  },
  "description": "Repository baseline for type-safe work: onboarding, shared instructions, and turn-level hooks that keep agents using the right local guidance.",
  "interface": {
    "brandColor": "#0F766E",
    "capabilities": [
      "Interactive",
      "Write"
    ],
    "category": "Engineering",
    "defaultPrompt": [
      "Use Engineering Baseline for this task.",
      "Review this repo with Engineering Baseline.",
      "Show the Engineering Baseline workflow."
    ],
    "developerName": "Amichne",
    "displayName": "Engineering Baseline",
    "longDescription": "Repository baseline for type-safe work: onboarding, shared instructions, and turn-level hooks that keep agents using the right local guidance.",
    "shortDescription": "Repository baseline for type-safe work: onboarding, shared instructio..."
  },
  "keywords": [
    "core",
    "daily-driver",
    "design",
    "engineering-baseline",
    "governance",
    "hooks",
    "instructions",
    "onboarding",
    "schemas",
    "skills"
  ],
  "license": "UNLICENSED",
  "name": "engineering-baseline",
  "skills": "./skills/",
  "version": "0.1.0"
}
