{
  "author": {
    "name": "Amichne"
  },
  "description": "Goal definition, test-driven implementation, Git hygiene, CI triage, and PR lifecycle procedures with explicit proof.",
  "interface": {
    "brandColor": "#0F766E",
    "capabilities": [
      "Interactive",
      "Write"
    ],
    "category": "Engineering",
    "defaultPrompt": [
      "Use Evidence Driven Delivery for this task.",
      "Review this repo with Evidence Driven Delivery.",
      "Show the Evidence Driven Delivery workflow."
    ],
    "developerName": "Amichne",
    "displayName": "Evidence Driven Delivery",
    "longDescription": "Goal definition, test-driven implementation, Git hygiene, CI triage, and PR lifecycle procedures with explicit proof.",
    "shortDescription": "Goal definition, test-driven implementation, Git hygiene, CI triage,..."
  },
  "keywords": [
    "ci",
    "evidence-driven-delivery",
    "git",
    "github",
    "planning",
    "pull-requests",
    "skills",
    "tdd",
    "testing",
    "workflow"
  ],
  "license": "UNLICENSED",
  "name": "evidence-driven-delivery",
  "skills": "./skills/",
  "version": "0.1.0"
}
