{
  "author": {
    "name": "Amichne"
  },
  "description": "Skill, agent, hook, shell script, schema, source-graph consolidation, and referential plugin authoring workflows composed from independent primitives.",
  "interface": {
    "brandColor": "#0F766E",
    "capabilities": [
      "Interactive",
      "Write"
    ],
    "category": "Engineering",
    "defaultPrompt": [
      "Use Primitive Authoring for this task.",
      "Review this repo with Primitive Authoring.",
      "Show the Primitive Authoring workflow."
    ],
    "developerName": "Amichne",
    "displayName": "Primitive Authoring",
    "longDescription": "Skill, agent, hook, shell script, schema, source-graph consolidation, and referential plugin authoring workflows composed from independent primitives.",
    "shortDescription": "Skill, agent, hook, shell script, schema, source-graph consolidation,..."
  },
  "keywords": [
    "agents",
    "consolidation",
    "hooks",
    "plugins",
    "primitive-authoring",
    "schemas",
    "shell",
    "skills",
    "source-graph"
  ],
  "license": "UNLICENSED",
  "name": "primitive-authoring",
  "skills": "./skills/",
  "version": "0.1.0"
}
